{
  "$schema": "./kanban.schema.json",
  "version": "0.2",
  "backend": { "driver": "local" },
  "meta": {
    "priorities": ["P0", "P1", "P2", "P3"],
    "categories": [],
    "columns": ["TODO", "DOING", "APPROVED", "BLOCKED"],
    "created_at": "__CREATED_AT__",
    "updated_at": "__UPDATED_AT__"
  },
  "tasks": []
}
